id,title,description,publishedDate,authors
-Q7y6beGZHAC,"Estudio del sector editorial de los juegos de rol en España :historia, tipología, perfil de lector, del autor, del traductor y del editor",Desconocido,2009-06-18,Héctor Sevillano Pareja
31EczgEACAAJ,$25 PlayStation Store Gift Card [Digital Code],"Kindly don't look past this. This Saturday, for the first run through as of late, we submissively request that you safeguard Wikipedia's freedom. 98% of our perusers don't give; they look the alternate way.",2020-12-07,Charlie Vigil
5XWXuQAACAAJ,El señor de los anillos,"Cuatro volúmenes en uno.Incluye los mapas y apéndices originales de J.R.R. Tolkien, y un índice de canciones, nombres de personajes, lugares y cosas. 50 ilustraciones en color de Alan Lee.",1993,"Alan Lee, J. R. R. Tolkien"
6463zwEACAAJ,The return of the king,Desconocido,1965,John Ronald Reuel Tolkien
70jL1nnXg3wC,Daniel in the Lions' Den,Desconocido,1996,Ronne Randall
BABWAQAACAAJ,The Lord of the Rings,"For over fifty years, J.R.R. Tolkien's peerless fantasy has accumulated worldwide acclaim as the greatest adventure tale ever written. No other writer has created a world as distinct as Middle-earth, complete with its own geography, history, languages, and legends. And no one has created characters as endearing as Tolkien's large-hearted, hairy-footed hobbits. Tolkien's The Lord of the Rings continues to seize the imaginations of readers of all ages, and this new three-volume paperback edition is designed to appeal to the youngest of them.",2002,J. R. R. Tolkien
DYmUGGwZ8_oC,El Señor de los Anillos no 01/03 La Comunidad del Anillo (edición revisada),"Primera entrega de la trilogía. «Este libro es como un relámpago en un cielo claro. Decir que la novela heroica, espléndida, elocuente y desinhibida, ha retornado de pronto en una época de un antirromanticismo casi patológico, sería inadecuado. Para quienes vivimos en esa extraña época, el retorno —y el alivio que nos trae— es sin duda lo más importante. Pero para la historia misma de la novela —una historia que se remonta a la Odisea y a antes de la Odisea— no es un retorno, sino un paso adelante o una revolución: la conquista de un territorio nuevo.» —C.S. Lewis, Time & Tide, 1954 «La obra de Tolkien, difundida en millones de ejemplares, traducida a docenas de lenguas, inspiradora de slogans pintados en las paredes de Nueva York y de Buenos Aires... una coherente mitología de una autenticidad universal creada en pleno siglo veinte.» —George Steiner, Le Monde, 1973",2010-07-15,J. R. R. Tolkien
FlGcUAnpMmIC,Hobbit's Travels,"Printed on deluxe recycled parchment paper, this journal celebrating J. R. R. Tolkien's classic tales makes a lovely gift, and is just as nice to keep! With magical two-color illustrations throughout (drawings made by Frodo Baggins's devoted companion, Sam Gamgee, on their travels throughout Middle-earth), it provides ample space for recording personal thoughts, reflections on Tolkien's masterpiece, or fantasies of your own creation.",2002-01-04,Sam Gamgee
GAcCAAAACAAJ,Los mundos mágicos de El señor de los anillos,Desconocido,2003,David Colbert
IOyjMQEACAAJ,The Power of the Ring,"Digging deep into J. R. R. Tolkien's spiritual biography--his religious scholarship and his love of both Christian and pagan myth--Stratford Caldecott offers a critical study of how the acclaimed author effectively created a vivid Middle Earth using the familiar rites and ceremonies of human history. And while readers and moviegoers alike may appreciate the fantasy world of The Hobbit and the Lord of the Rings trilogy, few know that in life, Tolkien was a devout Roman Catholic and that the characters, the events, and the general morality of each novel are informed by the dogmas of his faith. Revised and updated, this acclaimed study of Tolkien's achievement--previously released as Secret Fire in the UK--includes commentary on Peter Jackson's film adaptations and explores many of the fascinating stories and letters published after Tolkien's death.",2012-12-04,Stratford Caldecott
JUdOAAAACAAJ,The Lord of the Rings Sketchbook,"""In The Lord of the Rings Sketchbook Alan Lee reveals in pictures and in words how he created the watercolor paintings for the special centenary edition of The Lord of the Rings. These images would prove so powerful and evocative that they would eventually define the look of Peter Jackson's movie trilogy and earn him a coveted Academy Award."" ""The book is filled with more than 150 of his sketches and early conceptual pieces showing how the project progressed from idea to finished art. It also contains a selection of full-page paintings reproduced in full color, together with numerous examples of previously unseen conceptual art produced for the films and many new works drawn specially for this book."" ""The Lord of the Rings Sketchbook provides an insight into the imagination of the man who painted Tolkien's vision, first on the page and then in three dimensions on the movie screen. It will also be of interest to many of the thousands of people who have bought the illustrated Lord of the Rings as well as to budding artists who want to unlock the secrets of book illustration.""--BOOK JACKET.",2005,Alan Lee
LCZvVRqH-m8C,El señor de los anillos,Desconocido,1999-05,Terry Donaldson
MlwaEQAAQBAJ,Del blockbuster al autorretrato,"En este volumen, Ricardo Bedoya ofrece una visión panorámica de ciertos motivos, tendencias estilísticas y tratamientos rastreables en el cine internacional desde el inicio del siglo XXI. El volumen recoge apuntes sobre centenares de filmes, sopesados desde la perspectiva de un cinéfilo que no reconoce placeres culposos ni jerarquías entre las películas consideradas de arte y ensayo y aquellas que no abrigan tales pretensiones. El volumen se organiza a partir de algunas de las líneas recurrentes en el cine producido desde el año 2000. Comienza con una mirada a los títulos finales o póstumos de cineastas que cerraron sus carreras a inicios del siglo y sigue con un repaso por las distintas modalidades narrativas del cine de no ficción. El repaso continúa con una revisión de los diálogos que se establecen con los géneros cinematográficos, desde el wéstern hasta el terror, siempre vigentes, pero releídos a la luz de las sensibilidades contemporáneas, y presta atención también a las franquicias que abundan en secuelas, precuelas, reboots y spin offs. Otras líneas de aproximación incluyen los modos de imaginar cuerpos y mentes en el nuevo siglo, así como las miradas a la historia y a los conflictos de la actualidad o a la construcción de identidades e intimidades de individuos y grupos, entre otras tendencias del cine del nuevo siglo. Un libro imprescindible para quien quiera orientarse en la diversidad y riqueza de la cinematografía contemporánea.",2024-08-15,Ricardo Bedoya
RTDeDwAAQBAJ,"Handbook of Research on Transmedia Storytelling, Audience Engagement, and Business Strategies","As media evolves with technological improvement, communication changes alongside it. In particular, storytelling and narrative structure have adapted to the new digital landscape, allowing creators to weave immersive and enticing experiences that captivate viewers. These experiences have great potential in marketing and advertising, but the medium’s methods are so young that their potential and effectiveness is not yet fully understood. Handbook of Research on Transmedia Storytelling, Audience Engagement, and Business Strategies is a collection of innovative research that explores transmedia storytelling and digital marketing strategies in relation to audience engagement. Highlighting a wide range of topics including promotion strategies, business models, and prosumers and influencers, this book is ideally designed for digital creators, advertisers, marketers, consumer analysts, media professionals, entrepreneurs, managers, executives, researchers, academicians, and students.",2020-04-24,"Hernández-Santaolalla, Víctor, Barrientos-Bueno, Mónica"
SxZbEAAAQBAJ,1950 || 2005. Cinco decenios y medio de literatura universal,"Este libro no es un filtrado exhaustivo o en malla fina de la producción literaria del período que enuncia el título en el umbral. El autor ha intentado reunir sesenta y dos obras representativas del pensamiento, la expresión y la emotividad del lapso enunciado, el de la Guerra Fría, que es también el de numerosas piruetas bélicas y terrores nucleares para las poblaciones del llamado tercer mundo. Éste era y, en gran medida sigue siendo, lo que se disputan con modales macarras los mundos primero y segundo. Vale decir, la preeminencia política, la hegemonía planetaria. Se trata de sesenta y dos autores vindicativos, artistas comprometidos en la defensa de los valores fundamentales de la humanidad, que han conseguido conmover al público, y en algunos casos producir profundos cambios e incluso revoluciones sociales en sus hasta entonces desgraciadas naciones gobernadas por déspotas.",2022-01-22,Daniel Alcoba
W1F6Nu3gxEsC,Fantasía de aventuras,"Imaginar un relato de aventura y fantasía es un atractivo reto para guionistas y escritores de novelas. En estos géneros, a las dificultades propias de toda ficción se añaden otros problemas creativos, que apenas se contemplan en los manuales de guión o de técnicas novelísticas. Fantasía de aventuras aborda estas cuestiones desde un plano académico, y al mismo tiempo aporta las claves creativas empleadas por profesionales en este tipo de relatos, cada vez más demandados por espectadores y lectores, pero también por editoriales y productoras. Antonio Sánchez-Escalonilla, autor de Estrategias de guión cinematográfico, estudia las técnicas utilizadas por clásicos como Barrie, Roald Dahl, J.K. Rowling, Tolkien y C.S. Lewis, y analiza en profundidad las técnicas de cuatro directores que han cultivado con éxito el género de fantasía de aventuras: Tim Burton, George Lucas, M. Night Shyamalan y Steven Spielberg. Dirigido a estudiantes y profesionales, Fantasía de aventuras ofrece los recursos dramáticos imprescindibles en este tipo de creaciones literarias y cinematográficas.",2009-03,Antonio Sánchez-Escalonilla
ZcAlEAAAQBAJ,The Lord of the Rings Illustrated,"A sumptuous slipcased edition of Tolkien's classic epic tale of adventure, fully illustrated in color by the author himself. This deluxe volume is quarterbound in leather and includes many special features unique to this edition. Since it was first published in 1954, The Lord of the Rings has been a book people have treasured. Steeped in unrivalled magic and otherworldliness, its sweeping fantasy and epic adventure has touched the hearts of young and old alike. Over 100 million copies of its many editions have been sold around the world, and occasional collectors' editions become prized and valuable items of publishing. This one-volume deluxe slipcased edition contains the complete text, fully corrected and reset, which is printed in red and black, and features thirty color illustrations, maps, and sketches drawn by Tolkien himself as he composed this epic work. These include the pages from the Book of Mazarbul, marvelous facsimiles created by Tolkien to accompany the famous ""Bridge of Khazad-dum"" chapter. Also appearing are two poster-size, fold-out maps revealing all the detail of Middle-earth. This very special deluxe edition is quarterbound in cloth and red leather, with raised ribs on the spine and stamped in two foils. The pages are edged in gold and contained within are special features unique to this edition.",2021-10-19,J. R. R. Tolkien
aWZzLPhY4o0C,The Fellowship Of The Ring,"Begin your journey into Middle-earth... The inspiration for the upcoming original series on Prime Video, The Lord of the Rings: The Rings of Power. The Fellowship of the Ring is the first part of J.R.R. Tolkien’s epic adventure The Lord of the Rings. One Ring to rule them all, One Ring to find them, One Ring to bring them all and in the darkness bind them. Sauron, the Dark Lord, has gathered to him all the Rings of Power—the means by which he intends to rule Middle-earth. All he lacks in his plans for dominion is the One Ring—the ring that rules them all—which has fallen into the hands of the hobbit, Bilbo Baggins. In a sleepy village in the Shire, young Frodo Baggins finds himself faced with an immense task, as his elderly cousin Bilbo entrusts the Ring to his care. Frodo must leave his home and make a perilous journey across Middle-earth to the Cracks of Doom, there to destroy the Ring and foil the Dark Lord in his evil purpose.",2012-02-15,J.R.R. Tolkien
by0dzzQ6m8sC,J.R.R. Tolkien Encyclopedia,"This book presents the most recent scholarship on J.R.R. Tolkien, but also introduces and explores the author and scholar's life and work within their historical and cultural contexts. It examines Tolkien's fiction and his sources of influence along with his artistic and academic achievements, including his translations of medieval texts.",2006-11-06,Michael D.C. Drout
f5-uKpcOMhMC,Avalon Revisited,"This book contains a collection of essays dealing with different re-workings of the Arthurian myth. The papers trace the Arthurian myth, inquiring into its origins in Ancient Rome, and pointing out influences from the Dark Ages up to the present. Reference is made to oral tradition, visual narrative and iconic messages in manuscript illumination, the myth in medieval chivalry and the decay of the latter. Parallelisms are drawn with Christian figures and beliefs, with Irish literature and Gaelic mythology, and with novels and films. The methodological approaches and points of view show great diversity: from an inquiry into the historical sources of the myth, to comparative literature, inter-textuality, feminist criticism, analysis of cinema up to a refreshing practical classroom exercise.",2007,María José Álvarez Faedo
jZgjyAEACAAJ,The Return of the King,Desconocido,1967,John Ronald Reuel Tolkien
ld5GswEACAAJ,The Fellowship of the Ring,Frodo the hobbit and a band of warriors from the different kingdoms set out to destroy the Ring of Power before the evil Sauron grasps control.,2005,John Ronald Reuel Tolkien
nSYeAQAAIAAJ,Acerca de El señor de los anillos,Desconocido,2002,Pablo Soler Frost
q-2hXghg6kkC,El Secreto de los Films Que Triunfaron,Desconocido,2009,Peter Bart
q_P7oMO3lC4C,Trilogía El Señor de los Anillos,"La trilogía más esperada Concebida en un primer momento como una continuación de El Hobbit, acabó por convertirse en una historia independiente por derecho propio de mucho más alcance y extensión. En 1999 la trilogía de El Señor de los Anillos fue elegida como «Libro del Milenio» por los participantes de una encuesta de Amazon.com. En la adormecida e idílica Comarca, un joven hobbit recibe un encargo: custodiar el Anillo Único y emprender el viaje para su destrucción en las Grietas del Destino. Consciente de la importancia de su misión, Frodo abandona la Comarca e inicia el camino hacia Mordor con la compañía inesperada de Sam, Pippin y Merry. Pero sólo con la ayuda de Aragorn conseguirán vencer a los Jinetes Negros y alcanzar el refugio de la Casa de Elrond en Rivendel.",2012-12-14,J. R. R. Tolkien
u1SlueaOWQYC,Crear el hábito de leer,"Materiales de apoyo para crear el hábito de leer en el alumnado de la Educación Secundaria Obligatoria, con la novedad de abordar esta tarea desde el relato heroico de obras contemporáneas, tan atractivas para adolescentes y jóvenes como El Señor de los Anillos, la serie de Harry Potter y La historia interminable. Desde ellas, los jóvenes lectores pueden enlazar con otros relatos heroicos clásicos: Mío Cid, Lazarillo, Don Quijote, etc. Se analiza el origen y desarrollo de este género literario y se ofrecen criterios metodológicos, guías para la lectura y Unidades Didácticas sobre los relatos, como base para una educación en valores.",2005-05-17,"María del Mar Gallardo Samper, Isabel Romero Tabares"
wBg6fdFA8f8C,El viaje de Bilbo,"El Hobbit es la primera obra de Tolkien en la que explora el mundo mitológico que le haría famoso. El estilo directo y lineal, con alusiones (que el autor deploró más tarde) a un público infantil, no impide la poderosa irrupción de los grandes temas tolkienianos (el poder, la codicia, la guerra, la muerte, el paso del tiempo...) que reaparecerán en una dimensión a menudo obviamente épica en El Señor de los Anillos. Joseph Pearce, reconocido especialista en la obra de Tolkien, investiga en este libro los significados profundos de la aventura de Bilbo, que en una lectura superficial pueden pasar inadvertidos. Además de una fascinante historia de audacia y heroísmo, se trata en el fondo de un viaje de crecimiento interior, un aprendizaje del valor del sacrificio por los demás y un descubrimiento de la acción de la providencia en la vida de cada hombre (o hobbit, enano o elfo...). Para llegar a la verdadera intención del autor, es necesario trascender el significado literal de la obra y llegar a su nivel más profundo, pues solo así puede disfrutarse de toda su fuerza creativa.",2013-05-16,Joseph Pearce
xjo0EAAAQBAJ,El camino continúa Un viaje de Cristina a través de El Señor de los Anillos.,"La historia de Tolkien, El Señor de los Anillos, toca el alma de manera profunda. ¿Por qué? ¿Qué hace que los héroes sean tan atractivos? ¿Podemos llegar a ser como ellos? El poder de ser fuerte y valiente no se limita a la Tierra Media. A nosotros se nos han dado las mismas herramientas y los mismos dones que a ellos si los reconocemos. Los anillos de poder de nuestra sociedad nos tientan a nosotros y también a nuestros hijos. Seríamos sabios si despertáramos a aquello que pone a prueba nuestras almas. Mira este clásico desde una perspectiva cristiana, y puede que traigas la Tierra Media un poco más cerca de casa.",2021-05-16,A. K. Frailey
yK0Qi0R9U-IC,Impacto económico de las industrias culturales en Colombia,Economía y cultura - El sector cultural en tres escenarios - Sector editorial - Sector fonográfico - Cine - Sector televisión - La radio - Publicaciones periódicas - Recomendaciones de política sobre las industrias culturales en Colombia.,2003,Colombia. Ministerio de Cultura
zMK3GOMOpQ4C,PHP y MySQL,"Este libro pretende introducirnos en el conocimiento de una tecnología web de uso sencillo y que está al alcance de cualquier tipo de empresas, sin importar su tamaño, mediante el uso conjunto del lenguaje PHP y gestor de base de datos MySQL de forma conjunta. Y todo esto porque para su uso no es necesario contar con personal con profundos conocimientos técnicos. La intención de los autores ha sido escribir un libro de fácil lectura e interpretación para personas con conocimientos muy básicos de lenguajes de programación y con inquietudes por el desarrollo de sitios web. INDICE: Internet y la programación de ordenadores. Open Source y Software libre. Creación de páginas web mediante el lenguaje HTML. Introducción a PHP. PHP y los formularios de HTML. Sentencias de control. Definición de funciones. Arrays. Funciones predefinidas. Programación orientada a objetos. Cookies. Base de datos relacionales y el lenguaje SQL. El sistema gestor de base de datos MySQL. Funciones Open Source basadas en PHP y MySQL.",2005-07-06,Ángel Cobo
